{
  "target": "snare_drum_rim",
  "overall": {
    "msstft": {
      "value": 0.0,
      "missing_reason": null
    },
    "mfcc": {
      "value": 0.0,
      "missing_reason": null
    },
    "loudness_diff_db": {
      "value": 0.0,
      "missing_reason": null
    }
  },
  "segments": {
    "attack": {
      "msstft": {
        "value": 0.0,
        "missing_reason": null
      },
      "mfcc": {
        "value": 0.0,
        "missing_reason": null
      },
      "loudness_diff_db": {
        "value": 0.0,
        "missing_reason": null
      }
    },
    "transition": {
      "msstft": {
        "value": null,
        "missing_reason": "遷移部の区間境界（transition_end_s）が注釈として与えられていない"
      },
      "mfcc": {
        "value": null,
        "missing_reason": "遷移部の区間境界（transition_end_s）が注釈として与えられていない"
      },
      "loudness_diff_db": {
        "value": null,
        "missing_reason": "遷移部の区間境界（transition_end_s）が注釈として与えられていない"
      }
    },
    "sustain": {
      "msstft": {
        "value": null,
        "missing_reason": "定常部の区間境界（transition_end_s / sustain_end_s）が注釈として与えられていない"
      },
      "mfcc": {
        "value": null,
        "missing_reason": "定常部の区間境界（transition_end_s / sustain_end_s）が注釈として与えられていない"
      },
      "loudness_diff_db": {
        "value": null,
        "missing_reason": "定常部の区間境界（transition_end_s / sustain_end_s）が注釈として与えられていない"
      }
    },
    "release": {
      "msstft": {
        "value": null,
        "missing_reason": "リリースの区間境界（sustain_end_s）が注釈として与えられていない"
      },
      "mfcc": {
        "value": null,
        "missing_reason": "リリースの区間境界（sustain_end_s）が注釈として与えられていない"
      },
      "loudness_diff_db": {
        "value": null,
        "missing_reason": "リリースの区間境界（sustain_end_s）が注釈として与えられていない"
      }
    }
  },
  "bands": [
    {
      "lo_hz": 0.0,
      "hi_hz": 200.0,
      "error": {
        "value": 0.0,
        "missing_reason": null
      }
    },
    {
      "lo_hz": 200.0,
      "hi_hz": 800.0,
      "error": {
        "value": 0.0,
        "missing_reason": null
      }
    },
    {
      "lo_hz": 800.0,
      "hi_hz": 2000.0,
      "error": {
        "value": 0.0,
        "missing_reason": null
      }
    },
    {
      "lo_hz": 2000.0,
      "hi_hz": 5000.0,
      "error": {
        "value": 0.0,
        "missing_reason": null
      }
    },
    {
      "lo_hz": 5000.0,
      "hi_hz": 20000.0,
      "error": {
        "value": 0.0,
        "missing_reason": null
      }
    }
  ],
  "trajectories": {
    "transient_env_corr": {
      "value": 0.9999999999999998,
      "missing_reason": null
    },
    "f0_dist": {
      "value": null,
      "missing_reason": "target に有声フレームが存在しないためf0軌跡を算出できない"
    },
    "formant_dist": {
      "value": 0.0,
      "missing_reason": null
    }
  },
  "calc_conditions": {
    "schema_version": "2.0.0",
    "fft_sizes": [
      512,
      2048,
      8192
    ],
    "band_edges_hz": [
      0.0,
      200.0,
      800.0,
      2000.0,
      5000.0,
      20000.0
    ],
    "segment_boundaries_s": {
      "attack_end_s": 0.02,
      "transition_end_s": null,
      "sustain_end_s": null
    },
    "estimation_algorithms": [
      {
        "name": "pyin",
        "version": "0.11.0"
      },
      {
        "name": "stft-peak-tracking",
        "version": "1",
        "n_formants": 3,
        "frame_length": 1600,
        "hop_length": 320,
        "fft_size": 1024,
        "max_track_gap_hz": 300.0
      }
    ]
  }
}
